{
  "_id": "sha256:a80b27bf8bf6437122f78e014bde5b05d2c231f2b3e01e7549c6a2ea25a1eeb8",
  "schema_version": 1,
  "chunk_set_version": "sha256:ad520f17905f9ea24c9cb3558b2366bb489ca128eacaef05f9692e571e104416",
  "scene_set_version": "sha256:37c9ff2cbfb0890ef9c3f4963b1dbcb109d2f8f65a50db3a043cee8c76cbe7e1",
  "asset_version": "sha256:9f86d081884c7d659a2feaa0c55ad015a3bf4f1b2b0b822cd15d6c15b0f00a08",
  "chunking_fingerprint": "c7a1e2f3b4d5",
  "collection": "chunks_5e2d4c6b8a90",
  "vector_count": 1,
  "created_at": "2026-10-28T12:00:00Z",
  "lineage": {
    "step": "embedding",
    "fingerprint": "5e2d4c6b8a90",
    "inputs": [
      "chunk:sha256:66255afd3491caee0b6722ecd760422dca989661df7e139f327505317fbddd01"
    ],
    "version": "sha256:a80b27bf8bf6437122f78e014bde5b05d2c231f2b3e01e7549c6a2ea25a1eeb8",
    "image": null
  }
}
